{
  "$schema": "https://json-schema.org/draft/2020-12/schema",
  "$id": "deeplus.keyable-iteration-pattern-assignment-fixtures/r106",
  "type": "object",
  "required": ["schema", "contract", "cases", "governance"],
  "properties": {
    "schema": {"const": "deeplus.keyable-iteration-pattern-assignment-fixtures/r106"},
    "contract": {"const": "spec/contracts/keyable-iteration-pattern-assignment-r106.json"},
    "cases": {"type": "array", "minItems": 24, "maxItems": 24, "items": {"type": "object", "required": ["id", "algorithm", "class", "expected", "oracle"], "additionalProperties": true}},
    "governance": {"type": "object"}
  },
  "additionalProperties": false
}
